{
  "profile_version": "0.1",
  "user_id": "demo_user_001",
  "created_utc": "2026-03-03T00:00:00Z",
  "capability": {
    "turning_cost": 2.4,
    "backtracking_cost": 1.1,
    "slip": 0.18
  },
  "confidence": {
    "turning_cost_ci95": [
      2.0,
      2.8
    ],
    "backtracking_cost_ci95": [
      0.8,
      1.4
    ],
    "slip_ci95": [
      0.12,
      0.24
    ],
    "n_episodes": 60
  },
  "safety_limits": {
    "max_omega_rad_s": 0.6,
    "max_v_m_s": 0.35,
    "max_turns_per_meter": 0.9,
    "min_clearance_m": 0.25,
    "fallback_policy": "shared_control"
  },
  "notes": "Example profile for simulation."
}